SOURCE_ID;SOURCE_ID;STARTPERIOD;ENDPERIOD;TIMEPERIOD;FILE_PATH;TIME_PERIOD;WPA_OBS_RAW_COL;startPeriod;endPeriod;EXTRACTOR_CLASS;RAW_OBS_VALUE_COLUMN_NAME;SOURCE_TITLE;ENDPOINT_URL;SOMETHING;STUFF;INDICATOR_ID;VALUE_ID;SOURCE_TYPE;SOURCE_BODY;SOURCE_TITLE_default;ADDRESS;EXTRACTOR_CLASS_default;FROMER_SOURCE_ID;ENDPOINT_URL_default;un_treaty_data_col;WPA_OBS_RAW_COL_default;WPA_YEAR_COL;RAW_OBS_VALUE_COLUMN_NAME_default;COUNTRY_NAME_COLUMN_NAME;RAW_OBS_VALUE_TYPE;ATTR_RATIFICATION_DATE_COLUMN_NAME;ATTR_UNIT_MEASURE;INVERT_NORMALIZATION;DIMENSION_VALUES_NORMALIZATION;UNIT_MEASURE;COMMENTS;FILE_PATH_default;NRGI_SECTOR;COMMENT;PROJECT;INDEX;ISSUE;CATEGORY;INDICATOR_CODE_2018;INDICATOR_NAME;INDICATOR_DESCRIPTION;INDICATOR_EXPLANATION;STATUS;COMMENTS_default;EFFECTIVE_OF;CURRENT;CALCULATION_TYPE;LEGACY_DATA_FROM;REPLACES_IND_ID;INVERT_NORMALIZATION_default;DIMENSION_VALUES_NORMALIZATION_default;UNIT_MEASURE_default;CORRESPONDING_SOURCE;CORRESPONDING_VALUE_TYPE;SORTING_COLUMN;INDEX_CODE;ISSUE_CODE;CATEGORY_CODE;INDICATOR_CODE_PREFIX;INDICATOR_CODE;TYPE;RANGE;VALUE_ENCODING;VALUE_LABELS;NA_ENCODING;UNITS;CRBA_RELEASE_YEAR
119;S-168;xxx;xxx;xxx;;;;;;etl.source_adapter.un.UN_SDG_UN_POP;;"SDG Indicator 11.5.2, VC_DSR_ESDN:  
If possible, make relative to population
";https://unstats.un.org/SDGAPI/v1/sdg/Series/Data?seriesCode=VC_DSR_ESDN&pageSize=999999999;;;I-167;V-5;API (SDG) + UN data;UN SDG/ UN POP;"SDG Indicator 11.5.2, VC_DSR_ESDN:  
If possible, make relative to population
";https://unstats.un.org/sdgs/indicators/database/;etl.source_adapter.un.UN_SDG_UN_POP;S-186;https://unstats.un.org/SDGAPI/v1/sdg/Series/Data?seriesCode=VC_DSR_ESDN&pageSize=999999999;;;;;;;;Derived from SDG Indicator 1.5.1: Indicator 1.5.1, 11.5.1, 13.1.1, Series:  Number of people whose livelihoods were disrupted or destroyed, attributed to disasters. Instead of total, absolute number, this indicator indicates number per 100.000 population;inverted;"DIM_SDG_INDICATOR==""11.5.3""";RATE_100000;;;;;CRBA;Community and Environment;Natural disasters;Outcome;NEW;Disruption to education services	;Number of disruptions to educational services attributed to disasters;;Created;;2020.0;1.0;automated;;;inverted;"DIM_SDG_INDICATOR==""11.5.2""";RATE_100000;;;167.0;CE;ND;OC;CE_ND_OC_;CE_ND_OC_DIEDSE;Numeric;[0-100];Continuous variable;Continuous variable;;;2023
